{
  "$schema": "../../schema/migration.schema.json",
  "id": "rbi.it-governance.2023__rbi.aifi-cyber.2026",
  "old_instrument_id": "rbi.it-governance.2023",
  "new_instrument_id": "rbi.aifi-cyber.2026",
  "disclaimer": "These mappings are deterministic inferences, not authoritative legal conclusions. RBI published no clause-level concordance; every proposal requires review against the sources.",
  "method": "tfidf-word-ngram-explicit-change-rules",
  "method_version": "1.0",
  "mappings": [
    {
      "old_clause": "4",
      "old_excerpt": "4. IT Governance Framework\n(a) The key focus areas of IT Governance shall include strategic alignment, risk management, resource management, performance management and Business Continuity/ Disaster Recovery Management.\n(b) REs shall put in place a robust IT Governance Framework based on the aforementioned focus areas that inter alia:\nspecifies the governance structure and processes necessary to meet the RE’s business/ strategic objectives;\nspecifies the roles (including authority) and responsibilities of the Board of Directors (Board) / Board level Committee and Senior Management; and\nincludes adequate oversight mechanisms to ensure accountability and mitigation of IT and cyber/ information security risks.\n(c) Enterprise-wide risk management policy or operational risk management policy shall also incorporate periodic assessment of IT-related risks (both inherent and potential risk).\n",
      "old_char_start": 8764,
      "old_char_end": 9660,
      "status": "matched",
      "confidence": 0.684278,
      "candidates": [
        {
          "paragraph": "11",
          "pdf_page": 11,
          "score": 0.684278,
          "excerpt": "11. The AIFI shall put in place a robust IT Governance Framework based on the focus \nareas outlined in paragraph 10 above, that inter alia: \n(1) \nspecifies the governance structure and processes necessary to meet the \nAIFI’s business / strategic objectives; \n(2) \nspecifies the roles (including authority) and responsibilities of the Board of \nDirectors (Board) / Board level Committee and Senior Management; and \n(3) \nincludes adequate oversight mechanisms to ensure accountability and \nmitigation of IT and cyber / information security risks."
        },
        {
          "paragraph": "10",
          "pdf_page": 11,
          "score": 0.532389,
          "excerpt": "10. The key focus areas of IT Governance shall include strategic alignment, risk \nmanagement, resource management, performance management, and Business \nContinuity / DR Management."
        },
        {
          "paragraph": "12",
          "pdf_page": 11,
          "score": 0.441164,
          "excerpt": "12. Enterprise-wide risk management policy or operational risk management policy \nshall also incorporate periodic assessment of IT-related risks (both inherent and \npotential risk). \nB. \nInformation Security Policy and Cybersecurity Policy"
        }
      ],
      "method": "tfidf-word-ngram-explicit-change-rules",
      "method_version": "1.0",
      "reviewer": null
    },
    {
      "old_clause": "5",
      "old_excerpt": "5. Role of the Board of Directors\n(a) The strategies and policies related to IT, Information Assets, Business Continuity, Information Security, Cyber Security (including Incident Response and Recovery Management/ Cyber Crisis Management) shall be approved by the Board of Directors.\n(b) Such strategies and policies shall be reviewed at least annually by the Board.\n",
      "old_char_start": 9660,
      "old_char_end": 10026,
      "status": "matched",
      "confidence": 0.599214,
      "candidates": [
        {
          "paragraph": "6",
          "pdf_page": 10,
          "score": 0.599214,
          "excerpt": "6. \nThe Board of Directors shall approve the strategies and policies related to \nInformation Technology, Information Assets, Business Continuity, Information \nSecurity and Cybersecurity (including Incident Response and Recovery \nManagement / Cyber Crisis Management) frameworks."
        },
        {
          "paragraph": "7",
          "pdf_page": 10,
          "score": 0.253886,
          "excerpt": "7. \nSuch strategies and policies shall be placed before the Board for review at least \nannually. \nB. \nBoard Level Committees"
        },
        {
          "paragraph": "11",
          "pdf_page": 11,
          "score": 0.183053,
          "excerpt": "11. The AIFI shall put in place a robust IT Governance Framework based on the focus \nareas outlined in paragraph 10 above, that inter alia: \n(1) \nspecifies the governance structure and processes necessary to meet the \nAIFI’s business / strategic objectives; \n(2) \nspecifies the roles (including authority) and responsibilities of the Board of \nDirectors (Board) / Board level Committee and Senior Management; and \n(3) \nincludes adequate oversight mechanisms to ensure accountability and \nmitigation of IT and cyber / information security risks."
        }
      ],
      "method": "tfidf-word-ngram-explicit-change-rules",
      "method_version": "1.0",
      "reviewer": null
    },
    {
      "old_clause": "6",
      "old_excerpt": "6. IT Strategy Committee of the Board\n(a) REs shall establish a Board-level IT Strategy Committee (ITSC)\n8\n.\n(b) While constituting the ITSC, REs shall ensure:\nMinimum of three directors as members;\nThe Chairperson of the ITSC shall be an independent director and have substantial IT expertise\n9\nin managing/ guiding information technology initiatives; and\nMembers are technically competent\n10\n.\n(c) The ITSC shall meet at least on a quarterly basis.\n(d) The ITSC shall:\nEnsure that the RE has put an effective IT strategic planning process in place;\nGuide in preparation of IT Strategy and ensure that the IT Strategy aligns with the overall strategy of the RE towards accomplishment of its business objectives;\nSatisfy itself that the IT Governance and Information Security Governance structure fosters accountability, is effective and efficient, has adequate skilled resources, well defined objectives and unambiguous responsibilities for each level in the organisation;\nEnsure that the RE has put in place processes for assessing and managing IT and cybersecurity risks;\nEnsure that the budgetary allocations for the IT function (including for IT security), cyber security are commensurate with the RE’s IT maturity, digital depth, threat environment and industry standards and are utilised in a manner intended for meeting the stated objectives; and\nReview, at least on annual basis, the adequacy and effectiveness of the Business Continuity Planning and Disaster Recovery Management\n11\nof the RE.\n",
      "old_char_start": 10026,
      "old_char_end": 11529,
      "status": "matched",
      "confidence": 0.562872,
      "candidates": [
        {
          "paragraph": "18",
          "pdf_page": 12,
          "score": 0.562872,
          "excerpt": "18. The ITSC shall: \n(1) \nensure that the AIFI has put an effective IT strategic planning process in \nplace; \n(2) \nguide in preparation of IT Strategy and ensure that the IT Strategy aligns \nwith the overall strategy of the AIFI towards accomplishment of its business \nobjectives; \n(3) \nsatisfy itself that the IT Governance and Information Security Governance \nstructure fosters accountability, is effective and efficient, has adequate \nskilled \nresources, \nwell \n- \ndefined \nobjectives, \nand \nunambiguous \nresponsibilities for each level in the organisation; \nRBI (AIFIs – Cybersecurity, Technology: Risk, Resilience  \nand Assurance Framework) Directions, 2026 \n \n \n13 \n \n(4) \nensure that the AIFI has put in place processes for assessing and managing \nIT and cybersecurity risks; \n(5) \nensure that the budgetary allocations for the IT function, including for IT \nsecurity / cybersecurity, are commensurate with the AIFI’s IT maturity, digital \ndepth, threat environment, and industry standards and are utilised in a \nmanner intended for meeting the stated objectives;  \n(6) \nreview the organisational arrangements so that the security concerns are \nappreciated, receive adequate attention, and get escalated to appropriate \nlevels in the hierarchy to enable quick action;  \n(7) \nreview, at least on an annual basis, the adequacy and effectiveness of the \nBusiness Continuity Planning and Disaster Recovery (DR) Management of \nthe AIFI; \n(Note: The reference to Business Continuity / Disaster Recovery \nManagement in these Directions is limited to operational resilience \nfocussing on People, Processes, and Systems associated with the IT, \nInformation Systems (IS), information security / cybersecurity controls and \noperations.) \n(8) \nreview the assessment of IT capacity requirements and the measures taken \nto address the issues; and \n(9) \napprove documented standards and procedures for administering need-\nbased access to an information system.  \nD. \nSenior Management and IT Steering Committee"
        },
        {
          "paragraph": "15",
          "pdf_page": 12,
          "score": 0.348126,
          "excerpt": "15. The AIFI shall establish a Board-level IT Strategy Committee (ITSC)."
        },
        {
          "paragraph": "16",
          "pdf_page": 12,
          "score": 0.260964,